<?xml version="1.0"?>
<sms:annotation 
  xmlns="http://ecoinformatics.org/sms/annotation.0.9"
  xmlns:ont1="http://linus.nceas.ucsb.edu/sms/metacat/ont.3.1"
  xmlns:ont2="http://linus.nceas.ucsb.edu/sms/metacat/ont.5.1"
  xmlns:ont3="http://linus.nceas.ucsb.edu/sms/metacat/ont.6.1"
  xmlns:sms="http://ecoinformatics.org/sms/annotation.0.9"
  xmlns:xsi="http://www.w3.org/2001/XMLSchema-instance"
  xsi:schemaLocation="http://ecoinformatics.org/sms/annotation.0.9 sms-semannot.xsd"
  emlPackage="eml.1.1" dataTable="1">
    <sms:observation label="o1" distinct="yes">
        <sms:entity id="ont3:TemporalRange"/>
        <sms:measurement label="m1" key="yes">
            <sms:characteristic id="ont3:Year"/>
            <sms:standard id="ont1:DateTime"/>
        </sms:measurement>
    </sms:observation>
    <sms:observation label="o2">
        <sms:entity id="ont3:Tree"/>
        <sms:measurement label="m2" precision="0.1">
            <sms:characteristic id="ont3:DBH"/>
            <sms:standard id="ont2:Centimeter"/>
        </sms:measurement>
        <sms:measurement label="m3">
            <sms:characteristic id="ont3:TaxonomicTypeName"/>
            <sms:standard id="ont3:ITIS"/>
        </sms:measurement>
        <sms:measurement label="m4" key="yes">
            <sms:characteristic id="ont1:EntityName"/>
            <sms:standard id="ont3:LocalTreeNames"/>
        </sms:measurement>
        <sms:context observation="o1">
            <sms:relationship id="ont3:Within"/>
        </sms:context>
    </sms:observation>
    <sms:map attribute="yr" measurement="m1"/>
    <sms:map attribute="diam" measurement="m2" if="diam ge 0"/>
    <sms:map attribute="tree" measurement="m3"/>
    <sms:map attribute="spp" measurement="m4" value="Picea rubens" 
	   if="spp eq 'piru'"/>
    <sms:map attribute="spp" measurement="m4" value="Abies balsamea" 
	   if="spp eq 'abba'"/>
</sms:annotation>