<?xml version="1.0"?>
<sms:annotation
   xmlns="http://ecoinformatics.org/sms/annotation.0.9"
   xmlns:sms="http://ecoinformatics.org/sms/annotation.0.9"
   xmlns:oboe="https://code.ecoinformatics.org/code/semtools/trunk/dev/oboe/oboe.owl"
   xmlns:unit="https://code.ecoinformatics.org/code/semtools/trunk/dev/oboe/oboe-unit.owl"
   xmlns:gce="https://code.ecoinformatics.org/code/semtools/trunk/dev/oboe/oboe-gce.owl"
   xmlns:xsi="http://www.w3.org/2001/XMLSchema-instance"
   xsi:schemaLocation="http://ecoinformatics.org/sms/annotation.0.9 sms-semannot.xsd"
   emlPackage="eml.4.1"
   dataTable="1">

  <!-- observation: Spatial Location -->
   <sms:observation label="o1" distinct="yes">
      <sms:entity id="gce:SpatialLocation"/>
      <sms:measurement label="m1" key="yes">
         <sms:characteristic id="oboe:EntityName"/>
         <sms:standard id="gce:GCESiteNames"/>
         <sms:domain>
            <entity id="gce:Eulonia"/>
            <entity id="gce:FourMileIsland"/>
            <entity id="gce:NorthSapelo"/>
            <entity id="gce:Meridian"/>
            <entity id="gce:FollyRiver"/>
            <entity id="gce:DeanCreek"/>
            <entity id="gce:CarrsIsland"/>
            <entity id="gce:AlligatorCreek"/>
            <entity id="gce:RockdedundyIsland"/>
            <entity id="gce:HuntCamp"/>
         </sms:domain>
      </sms:measurement>
   </sms:observation>

  <!-- mapping: Spatial Location -->
   <sms:map attribute="att.4" measurement="m1"
      if="att.4 eq 1" value="GCE1"/>
   <sms:map attribute="att.4" measurement="m1"
      if="att.4 eq 2" value="GCE2"/>
   <sms:map attribute="att.4" measurement="m1"
      if="att.4 eq 3" value="GCE3"/>
   <sms:map attribute="att.4" measurement="m1"
      if="att.4 eq 4" value="GCE4"/>
   <sms:map attribute="att.4" measurement="m1"
      if="att.4 eq 5" value="GCE5"/>
   <sms:map attribute="att.4" measurement="m1"
      if="att.4 eq 6" value="GCE6"/>
   <sms:map attribute="att.4" measurement="m1"
      if="att.4 eq 7" value="GCE7"/>
   <sms:map attribute="att.4" measurement="m1"
      if="att.4 eq 8" value="GCE8"/>
   <sms:map attribute="att.4" measurement="m1"
      if="att.4 eq 9" value="GCE9"/>
   <sms:map attribute="att.4" measurement="m1"
      if="att.4 eq 10" value="GCE10"/>


  <!-- observation: Temporal Point -->
   <sms:observation label="o2" distinct="yes">
      <sms:entity id="gce:TemporalPoint"/>
      <sms:measurement label="m2a" key="yes">
         <sms:characteristic id="gce:Year"/>
         <sms:standard id="gce:DateTimeYYYY"/>
      </sms:measurement>
      <sms:measurement label="m2b" key="yes">
         <sms:characteristic id="gce:Month"/>
         <sms:standard id="gce:DateTimeMM"/>
      </sms:measurement>
      <sms:measurement label="m2c" key="yes">
         <sms:characteristic id="gce:Day"/>
         <sms:standard id="gce:DateTimeDD"/>
      </sms:measurement>
   </sms:observation>

  <!-- mapping: Temporal Point -->
   <sms:map attribute="att.1" measurement="m2a"/>
   <sms:map attribute="att.2" measurement="m2b"/>
   <sms:map attribute="att.3" measurement="m2c"/>

   
  <!-- observation: Zone -->
   <sms:observation label="o3" distinct="yes">
      <sms:entity id="gce:Zone"/>
      <sms:measurement label="m3" key="yes">
         <sms:characteristic id="oboe:EntityType"/>
         <sms:standard id="gce:ZoneTypeNames"/>
         <sms:domain>
            <entity id="gce:CreekBankZone"/>
            <entity id="gce:HighMarshZone"/>
         </sms:domain>
      </sms:measurement>
   </sms:observation>

  <!-- mapping: Zone -->
   <sms:map attribute="att.5" measurement="m3"
      if="att.5 eq 1" value="CreekBank"/>
   <sms:map attribute="att.5" measurement="m3"
      if="att.5 eq 2" value="HighMarsh"/>


  <!-- observation: ReplicatePlot -->
   <sms:observation label="o4" distinct="yes">
      <sms:entity id="gce:ReplicatePlot"/>
      <sms:measurement label="m4a" key="yes">
         <sms:characteristic id="oboe:EntityName"/>
         <sms:standard id="oboe:Nominal"/>
      </sms:measurement>
      <sms:context observation="o1" identifying="yes">
         <sms:relationship id="gce:Within"/>
      </sms:context>
      <sms:context observation="o3" identifying="yes">
         <sms:relationship id="gce:Within"/>
      </sms:context>
   </sms:observation>
   
  <!-- mapping: ReplicatePlot -->
   <sms:map attribute="att.6" measurement="m4a"/>


  <!-- observation: Mollusc -->
   <sms:observation label="o5" distinct="no">
      <sms:entity id="gce:Mollusc"/>
      <sms:measurement label="m5a" key="no">
         <sms:characteristic id="oboe:EntityType"/>
         <sms:standard id="gce:PopulationTypeNames"/>
         <sms:domain>
            <entity id="gce:LittorariaIrrorata"/>
            <entity id="gce:MelampusBidentatus"/>
            <entity id="gce:DetraciaFloridana"/>            
            <entity id="gce:Hydrobiidae"/>            
            <entity id="gce:GeukensiaDemissa"/>            
            <entity id="gce:PolymesodaCaroliniana"/>            
            <entity id="gce:GemmaGemma"/>            
         </sms:domain>
      </sms:measurement>
      <sms:measurement label="m5b" precision="0.01" key="no">
         <sms:characteristic id="unit:Length"/>
         <sms:standard id="unit:Millimeter"/>
      </sms:measurement>
      <sms:context observation="o4" identifying="no">
         <sms:relationship id="gce:Within"/>
      </sms:context>
      <sms:context observation="o2" identifying="no">
         <sms:relationship id="gce:Within"/>
      </sms:context>
      <sms:context observation="o6" identifying="no">
         <sms:relationship id="gce:HasPart"/>
      </sms:context>
   </sms:observation>  
  
   <!-- mapping: Mollusc -->
   <sms:map attribute="att.7" measurement="m5a" 
	   if="att.7 eq 'Littoraria'" value="LittorariaIrrorata"/>
   <sms:map attribute="att.7" measurement="m5a" 
	   if="att.7 eq 'Melampus'" value="MelampusBidentatus"/>
   <sms:map attribute="att.7" measurement="m5a" 
	   if="att.7 eq 'Detracia'" value="DetraciaFloridana"/>
   <sms:map attribute="att.7" measurement="m5a" 
	   if="att.7 eq 'Hydrobiidae'" value="Hydrobiidae"/>
   <sms:map attribute="att.7" measurement="m5a" 
	   if="att.7 eq 'Geukensia'" value="GeukensiaDemissa"/>
   <sms:map attribute="att.7" measurement="m5a" 
	   if="att.7 eq 'Polymesoda'" value="PolymesodaCaroliniana"/>
   <sms:map attribute="att.7" measurement="m5a" 
	   if="att.7 eq 'Gemma'" value="GemmaGemma"/>
   <sms:map attribute="att.8" measurement="m5b"/>

  <!-- observation: MolluscShell -->
   <sms:observation label="o6" distinct="no">
      <sms:entity id="gce:MolluscShell"/>
      <sms:measurement label="m6a" key="no">
         <sms:characteristic id="gce:ShellCondition"/>
         <sms:standard id="gce:ShellConditionCodes"/>
      </sms:measurement>
      <sms:context observation="o4" identifying="no">
         <sms:relationship id="gce:PartOf"/>
      </sms:context>
   </sms:observation>  

   <sms:map attribute="att.9" measurement="m6a"
      if="att.9 eq 0" value="ShellUndamagedCode"/>
   <sms:map attribute="att.9" measurement="m6a"
      if="att.9 eq 1" value="ShellDamagedCode"/>

</sms:annotation>

